Title,Year,IMDb Rating,Certificates,Genre,Director,Star Cast,MetaScore,Duration (minutes)
10 Things I Hate About You,1999,7.3,PG-13,Comedy,Gil Junger,Heath LedgerJulia StilesJoseph Gordon-Levitt,70.0,97.0
12 Angry Men,1957,9.0,Approved,Crime,Sidney Lumet,Reginald Rose,97.0,96.0
28 Days Later,2002,7.5,R,Drama,Danny Boyle,Cillian MurphyNaomie HarrisChristopher Eccleston,73.0,113.0
A Quiet Place,2018,7.5,PG-13,Drama,John Krasinski,Bryan WoodsScott BeckJohn Krasinski,82.0,90.0
A Quiet Place: Day One,2024,7.1,R,Drama,Michael Sarnoski,Michael SarnoskiJohn KrasinskiBryan Woods,66.9,116.3
A Serbian Film,2010,5.0,NC-17,Horror,Srdjan Spasojevic,Srdjan 'Zika' TodorovicSergej TrifunovicJelena Gavrilovic,66.9,104.0
A Simple Favor,2018,6.8,R,Comedy,Paul Feig,Anna KendrickBlake LivelyHenry Golding,67.0,117.0
Abigail,2024,6.7,R,Horror,Matt Bettinelli-Olpin,Melissa BarreraDan StevensAlisha Weir,62.0,109.0
Alien,1979,8.5,R,Horror,Ridley Scott,Dan O'BannonRonald Shusett,89.0,117.0
Alien: Romulus,2024,7.1,R,Horror,Fede Alvarez,Fede AlvarezRodo SayaguesDan O'Bannon,66.9,116.3
American Fiction,2023,7.5,R,Comedy,Cord Jefferson,Jeffrey WrightTracee Ellis RossJohn Ortiz,81.0,117.0
Anatomy of a Fall,2023,7.7,R,Crime,Justine Triet,Sandra HüllerSwann ArlaudMilo Machado-Graner,86.0,151.0
Animal,2023,6.2,Not Rated,Action,Sandeep Reddy Vanga,Suresh BandaruSaurabh GuptaPranay Reddy Vanga,33.0,204.0
Anora,2024,7.9,R,Comedy,Sean Baker,Mikey MadisonMark EydelshteynYura Borisov,89.0,116.3
Anyone But You,2023,6.1,R,Comedy,Will Gluck,Ilana WolpertWill Gluck,52.0,103.0
Arcadian,2024,5.5,R,Action,Benjamin Brewer,Nicolas CageJaeden MartellMaxwell Jenkins,60.0,92.0
Argylle,2024,5.7,PG-13,Action,Matthew Vaughn,Henry CavillBryce Dallas HowardSam Rockwell,35.0,139.0
Arthur the King,2024,7.0,PG-13,Adventure,Simon Cellan Jones,Mark WahlbergSimu LiuJuliet Rylance,54.0,107.0
Atlas,2024,5.6,PG-13,Action,Brad Peyton,Jennifer LopezSimu LiuSterling K. Brown,37.0,118.0
Avengers: Endgame,2019,8.4,PG-13,Action,Anthony Russo,Christopher MarkusStephen McFeelyStan Lee,78.0,181.0
Babes,2024,6.5,R,Comedy,Pamela Adlon,Elena OuspenskaiaSandra BernhardOliver Platt,74.0,104.0
Baby Driver,2017,7.5,R,Action,Edgar Wright,Ansel ElgortJon BernthalJon Hamm,86.0,113.0
Bad Boys: Ride or Die,2024,7.1,R,Action,Adil El Arbi,Will SmithMartin LawrenceVanessa Hudgens,66.9,116.3
Barbarian,2022,7.0,R,Horror,Zach Cregger,Georgina CampbellBill SkarsgårdJustin Long,78.0,102.0
Barbie,2023,6.8,PG-13,Adventure,Greta Gerwig,Margot RobbieRyan GoslingIssa Rae,80.0,114.0
Beetlejuice,1988,7.5,PG,Comedy,Tim Burton,Michael McDowellLarry WilsonWarren Skaaren,71.0,92.0
Beetlejuice Beetlejuice,2024,7.1,R,Comedy,Tim Burton,Alfred GoughMiles MillarSeth Grahame-Smith,66.9,116.3
Beverly Hills Cop,1984,7.4,R,Action,Martin Brest,Daniel Petrie Jr.Danilo Bach,66.0,105.0
Beverly Hills Cop: Axel F,2024,7.1,R,Action,Mark Molloy,Will BeallTom GormicanKevin Etten,66.9,115.0
Blade Runner 2049,2017,8.0,R,Action,Denis Villeneuve,Hampton FancherMichael GreenPhilip K. Dick,81.0,164.0
Borderlands,2024,7.1,R,Action,Eli Roth,Eli RothJoe Crombie,66.9,116.3
Boy Kills World,2023,6.5,R,Action,Moritz Mohr,Tyler Burton SmithArend RemmersMoritz Mohr,47.0,111.0
Bullet Train,2022,7.3,R,Action,David Leitch,Brad PittJoey KingAaron Taylor-Johnson,49.0,127.0
Cars,2006,7.2,G,Animation,John Lasseter,John LasseterJoe RanftJorgen Klubien,73.0,116.0
Castle in the Sky,1986,8.0,PG,Animation,Hayao Miyazaki,Hayao MiyazakiJonathan Swift,78.0,125.0
Charlie and the Chocolate Factory,2005,6.7,PG,Adventure,Tim Burton,Johnny DeppFreddie HighmoreDavid Kelly,72.0,115.0
Civil War,2024,7.4,R,Action,Alex Garland,Kirsten DunstWagner MouraCailee Spaeny,75.0,109.0
Coco,2017,8.4,PG,Animation,Lee Unkrich,Lee UnkrichJason KatzMatthew Aldrich,81.0,105.0
Crew,2024,6.1,R,Comedy,Rajesh A Krishnan,TabuKareena KapoorKriti Sanon,66.9,116.3
Damsel,2024,6.1,PG-13,Action,Juan Carlos Fresnadillo,Millie Bobby BrownRay WinstoneAngela Bassett,46.0,110.0
Dawn of the Planet of the Apes,2014,7.6,PG-13,Action,Matt Reeves,Mark BombackRick JaffaAmanda Silver,79.0,130.0
Deadpool,2016,8.0,R,Action,Tim Miller,Ryan ReynoldsMorena BaccarinT.J. Miller,65.0,108.0
Deadpool & Wolverine,2024,7.1,R,Action,Shawn Levy,Shawn LevyRhett ReeseRyan Reynolds,66.9,116.3
Deadpool 2,2018,7.6,R,Action,David Leitch,Rhett ReesePaul WernickRyan Reynolds,66.0,119.0
Descendants: The Rise of Red,2024,7.1,TV-G,Action,Jennifer Phang,Rita OraJoshua ColleyChina Anne McClain,66.9,116.3
Despicable Me 4,2024,7.1,PG,Animation,Chris Renaud,Steve CarellKristen WiigJoey King,66.9,95.0
Disturbia,2007,6.8,PG-13,Crime,D.J. Caruso,Christopher LandonCarl Ellsworth,62.0,105.0
Dream Scenario,2023,6.9,R,Comedy,Kristoffer Borgli,Lily BirdNicolas CageJulianne Nicholson,74.0,102.0
Dune,1984,6.3,PG-13,Action,David Lynch,Kyle MacLachlanVirginia MadsenFrancesca Annis,41.0,137.0
Dune,2021,8.0,PG-13,Action,Denis Villeneuve,Jon SpaihtsDenis VilleneuveEric Roth,74.0,155.0
Dune: Part Two,2024,8.6,PG-13,Action,Denis Villeneuve,Timothée ChalametZendayaRebecca Ferguson,79.0,166.0
Elemental,2023,7.0,PG,Animation,Peter Sohn,John HobergKat LikkelBrenda Hsueh,58.0,101.0
Emilia Perez,2024,7.2,R,Comedy,Jacques Audiard,Jacques AudiardThomas BidegainNicolas Livecchi,70.0,116.3
Encanto,2021,7.2,PG,Animation,Jared Bush,Charise Castro SmithJared BushByron Howard,75.0,102.0
Exhuma,2024,7.0,R,Horror,Jang Jae-hyun,Jang Jae-hyun,66.9,116.3
Finding Nemo,2003,8.2,G,Animation,Andrew Stanton,Andrew StantonBob PetersonDavid Reynolds,90.0,100.0
Five Nights at Freddy's,2023,5.5,PG-13,Horror,Emma Tammi,Scott CawthonSeth CuddebackEmma Tammi,33.0,109.0
Force of Nature: The Dry 2,2024,6.0,R,Crime,Robert Connolly,Eric BanaAnna TorvDeborra-Lee Furness,58.0,120.0
Frozen,2013,7.4,PG,Animation,Chris Buck,Jennifer LeeHans Christian AndersenChris Buck,75.0,102.0
Furiosa: A Mad Max Saga,2024,7.9,R,Action,George Miller,Anya Taylor-JoyChris HemsworthTom Burke,79.0,148.0
Garfield: The Movie,2004,5.0,PG,Adventure,Peter Hewitt,Breckin MeyerJennifer Love HewittStephen Tobolowsky,27.0,80.0
Ghostbusters,1984,7.8,PG,Action,Ivan Reitman,Bill MurrayDan AykroydSigourney Weaver,71.0,105.0
Ghostbusters: Afterlife,2021,7.0,PG-13,Adventure,Jason Reitman,Gil KenanJason ReitmanIvan Reitman,45.0,124.0
Ghostbusters: Frozen Empire,2024,6.2,PG-13,Adventure,Gil Kenan,Gil KenanJason ReitmanIvan Reitman,46.0,115.0
Gladiator,2000,8.5,R,Action,Ridley Scott,David FranzoniJohn LoganWilliam Nicholson,67.0,155.0
Glass,2019,6.6,PG-13,Drama,M. Night Shyamalan,M. Night Shyamalan,43.0,129.0
Godzilla Minus One,2023,7.9,PG-13,Action,Takashi Yamazaki,Ryunosuke KamikiMinami HamabeSakura Andô,81.0,124.0
Godzilla vs. Kong,2021,6.3,PG-13,Action,Adam Wingard,Terry RossioMichael DoughertyZach Shields,59.0,113.0
Godzilla x Kong: The New Empire,2024,6.2,PG-13,Action,Adam Wingard,Terry RossioAdam WingardSimon Barrett,47.0,115.0
Golden Kamuy,2024,6.4,R,Action,Shigeaki Kubo,Kento YamazakiAnna YamadaYûma Yamoto,66.9,116.3
Goodfellas,1990,8.7,R,Biography,Martin Scorsese,Nicholas PileggiMartin Scorsese,92.0,145.0
Harold and the Purple Crayon,2024,7.1,PG,Animation,Carlos Saldanha,Zachary LeviLil Rel HoweryBenjamin Bottani,66.9,92.0
Harry Potter and the Chamber of Secrets,2002,7.4,PG,Adventure,Chris Columbus,Daniel RadcliffeRupert GrintEmma Watson,63.0,161.0
Harry Potter and the Deathly Hallows: Part 2,2011,8.1,PG-13,Adventure,David Yates,Daniel RadcliffeEmma WatsonRupert Grint,85.0,130.0
Harry Potter and the Goblet of Fire,2005,7.7,PG-13,Adventure,Mike Newell,Daniel RadcliffeEmma WatsonRupert Grint,81.0,157.0
Harry Potter and the Prisoner of Azkaban,2004,7.9,PG,Adventure,Alfonso Cuarón,Daniel RadcliffeEmma WatsonRupert Grint,82.0,142.0
Harry Potter and the Sorcerer's Stone,2001,7.6,PG,Adventure,Chris Columbus,Daniel RadcliffeRupert GrintEmma Watson,65.0,152.0
Heat,1995,8.3,R,Action,Michael Mann,Al PacinoRobert De NiroVal Kilmer,76.0,170.0
Her,2013,8.0,R,Drama,Spike Jonze,Joaquin PhoenixAmy AdamsScarlett Johansson,91.0,126.0
Hercules,1997,7.3,G,Animation,Ron Clements,Ron ClementsJohn MuskerDon McEnery,74.0,93.0
Hereditary,2018,7.3,R,Drama,Ari Aster,Toni ColletteMilly ShapiroGabriel Byrne,87.0,127.0
Hit Man,2023,7.4,R,Action,Richard Linklater,Adria ArjonaGlen PowellRetta,83.0,115.0
Howl's Moving Castle,2004,8.2,PG,Animation,Hayao Miyazaki,Chieko BaishôTakuya KimuraTatsuya Gashûin,82.0,119.0
I Saw the TV Glow,2024,6.9,PG-13,Drama,Jane Schoenbrun,Justice SmithBrigette Lundy-PaineIan Foreman,84.0,100.0
IF,2024,6.7,PG,Animation,John Krasinski,Cailey FlemingRyan ReynoldsJohn Krasinski,46.0,104.0
Immaculate,2024,5.8,R,Horror,Michael Mohan,Sydney SweeneyÁlvaro MorteSimona Tabasco,57.0,89.0
In a Violent Nature,2024,5.7,R,Drama,Chris Nash,Chris Nash,65.0,116.3
In the Land of Saints and Sinners,2023,6.3,R,Action,Robert Lorenz,Kerry CondonDesmond EastwoodConor MacNeill,60.0,106.0
Inception,2010,8.8,PG-13,Action,Christopher Nolan,Leonardo DiCaprioJoseph Gordon-LevittElliot Page,74.0,148.0
Inglourious Basterds,2009,8.4,R,Adventure,Quentin Tarantino,Brad PittDiane KrugerEli Roth,69.0,153.0
Inside Out,2015,8.1,PG,Animation,Pete Docter,Pete DocterRonnie Del CarmenMeg LeFauve,94.0,95.0
Inside Out 2,2024,7.1,PG,Animation,Kelsey Mann,Amy PoehlerPhyllis SmithLewis Black,66.9,100.0
Interstellar,2014,8.7,PG-13,Adventure,Christopher Nolan,Matthew McConaugheyAnne HathawayJessica Chastain,74.0,169.0
It,2017,7.3,R,Fantasy,Andy Muschietti,Chase PalmerCary Joji FukunagaGary Dauberman,69.0,135.0
John Wick: Chapter 4,2023,7.7,R,Action,Chad Stahelski,Keanu ReevesLaurence FishburneGeorge Georgiou,78.0,169.0
Joker,2019,8.4,R,Crime,Todd Phillips,Todd PhillipsScott SilverBob Kane,59.0,122.0
Jumanji,1995,7.1,PG,Adventure,Joe Johnston,Jonathan HensleighGreg TaylorJim Strain,39.0,104.0
Jurassic Park,1993,8.2,PG-13,Action,Steven Spielberg,Michael CrichtonDavid Koepp,68.0,127.0
Kill Bill: Vol. 1,2003,8.2,R,Action,Quentin Tarantino,"Quentin Tarantino ,Uma Thurman",69.0,111.0
Killers of the Flower Moon,2023,7.6,R,Crime,Martin Scorsese,Leonardo DiCaprioRobert De NiroLily Gladstone,89.0,206.0
Kinds of Kindness,2024,7.0,R,Comedy,Yorgos Lanthimos,Efthimis FilippouYorgos Lanthimos,72.0,164.0
Kingdom of the Planet of the Apes,2024,7.2,PG-13,Action,Wes Ball,Owen TeagueFreya AllanKevin Durand,66.0,145.0
Kung Fu Panda,2008,7.6,PG,Animation,Mark Osborne,Jonathan AibelGlenn BergerEthan Reiff,74.0,92.0
Kung Fu Panda 4,2024,6.3,PG,Animation,Mike Mitchell,Jonathan AibelGlenn BergerDarren Lemke,54.0,94.0
Laapataa Ladies,2023,8.5,R,Comedy,Kiran Rao,Nitanshi GoelPratibha RantaSparsh Shrivastava,66.9,116.3
Land of Bad,2024,6.5,R,Action,William Eubank,Liam HemsworthRussell CroweLuke Hemsworth,57.0,113.0
Late Night with the Devil,2023,7.1,R,Horror,Cameron Cairnes,David DastmalchianLaura GordonIan Bliss,72.0,93.0
Lisa Frankenstein,2024,6.1,PG-13,Comedy,Zelda Williams,Kathryn NewtonLiza SoberanoJenna Davis,47.0,101.0
Longlegs,2024,7.1,R,Crime,Oz Perkins,Nicolas CageMaika MonroeAlicia Witt,66.9,101.0
Love Lies Bleeding,2024,6.7,R,Action,Rose Glass,Anna BaryshnikovKristen StewartDave Franco,77.0,104.0
Léon: The Professional,1994,8.5,R,Action,Luc Besson,Jean RenoGary OldmanNatalie Portman,64.0,110.0
MaXXXine,2024,7.1,R,Crime,Ti West,Ti West,66.9,103.0
Mad Max,1979,6.8,R,Action,George Miller,James McCauslandGeorge MillerByron Kennedy,73.0,88.0
Mad Max 2: The Road Warrior,1981,7.6,R,Action,George Miller,Terry HayesGeorge MillerBrian Hannant,77.0,96.0
Mad Max Beyond Thunderdome,1985,6.2,PG-13,Action,George Miller,Terry HayesGeorge MillerByron Kennedy,71.0,107.0
Mad Max: Fury Road,2015,8.1,R,Action,George Miller,Tom HardyCharlize TheronNicholas Hoult,90.0,120.0
Madame Web,2024,3.9,PG-13,Action,S.J. Clarkson,Matt SazamaBurk SharplessClaire Parker,26.0,116.0
Madgaon Express,2024,7.2,R,Comedy,Kunal Kemmu,Divyendu SharmaPratik GandhiAvinash Tiwary,66.9,116.3
Mandy,2018,6.5,Not Rated,Action,Panos Cosmatos,Panos CosmatosAaron Stewart-AhnCasper Kelly,83.0,121.0
Manjummel Boys,2024,8.4,R,Adventure,Chidambaram,Soubin ShahirSreenath BhasiBalu Varghese,66.9,116.3
Mars Express,2023,7.5,Not Rated,Animation,Jérémie Périn,Léa DruckerMathieu AmalricDaniel Njo Lobé,76.0,88.0
Megalopolis,2024,7.0,R,Drama,Francis Ford Coppola,Adam DriverGiancarlo EspositoNathalie Emmanuel,58.0,116.3
Midsommar,2019,7.1,R,Drama,Ari Aster,Florence PughJack ReynorVilhelm Blomgren,72.0,148.0
Migration,2023,6.7,PG,Animation,Benjamin Renner,Mike WhiteBenjamin RennerKen Daurio,56.0,83.0
Miller's Girl,2024,5.2,R,Comedy,Jade Halley Bartlett,Martin FreemanJenna OrtegaBashir Salahuddin,41.0,93.0
Minecraft,2025,7.1,R,Action,Jared Hess,Chris BowmanHubbel PalmerAllison Schroeder,66.9,116.3
Miss Peregrine's Home for Peculiar Children,2016,6.7,PG-13,Adventure,Tim Burton,Eva GreenAsa ButterfieldSamuel L. Jackson,57.0,127.0
Mission: Impossible - Dead Reckoning Part One,2023,7.7,PG-13,Action,Christopher McQuarrie,Tom CruiseHayley AtwellVing Rhames,81.0,163.0
Moana,2016,7.6,PG,Animation,Ron Clements,Ron ClementsJohn MuskerDon Hall,81.0,107.0
Moana 2,2024,7.1,R,Animation,David G. Derrick Jr.,Gil KenanJason ReitmanIvan Reitman,66.9,116.3
Monkey Man,2024,6.9,R,Action,Dev Patel,Dev PatelPaul AngunawelaJohn Collee,70.0,121.0
Monster,2023,4.6,TV-MA,Horror,Rako Prijanto,Marsha TimothyAlex AbbadAnantya Kirana,66.9,86.0
"Monsters, Inc.",2001,8.1,G,Animation,Pete Docter,Pete DocterJill CultonJeff Pidgeon,79.0,92.0
Mother of the Bride,2024,4.8,TV-PG,Comedy,Mark Waters,Brooke ShieldsMiranda CosgroveBenjamin Bratt,39.0,88.0
Mothers' Instinct,2024,6.3,R,Drama,Benoît Delhomme,Anne HathawayJessica ChastainJosh Charles,46.0,116.3
Mufasa: The Lion King,2024,7.1,R,Animation,Barry Jenkins,Linda WoolvertonIrene MecchiJonathan Roberts,66.9,116.3
No Country for Old Men,2007,8.2,R,Crime,Ethan Coen,Tommy Lee JonesJavier BardemJosh Brolin,92.0,122.0
No Hard Feelings,2023,6.4,R,Comedy,Gene Stupnitsky,Jennifer LawrenceAndrew Barth FeldmanLaura Benanti,59.0,103.0
Nope,2022,6.8,R,Horror,Jordan Peele,Daniel KaluuyaKeke PalmerBrandon Perea,77.0,130.0
Nosferatu,2024,7.1,R,Fantasy,Robert Eggers,Aaron Taylor-JohnsonBill SkarsgårdNicholas Hoult,66.9,116.3
Once Upon a Time... in Hollywood,2019,7.6,R,Comedy,Quentin Tarantino,Leonardo DiCaprioBrad PittMargot Robbie,84.0,161.0
Pearl,2022,7.0,R,Drama,Ti West,Ti WestMia Goth,76.0,103.0
Planet of the Apes,1968,8.0,G,Adventure,Franklin J. Schaffner,Michael WilsonRod SerlingPierre Boulle,79.0,112.0
Planet of the Apes,2001,5.7,PG-13,Action,Tim Burton,Pierre BoulleWilliam Broyles Jr.Lawrence Konner,50.0,120.0
Poor Things,2023,7.9,R,Comedy,Yorgos Lanthimos,Emma StoneMark RuffaloWillem Dafoe,88.0,141.0
Prisoners,2013,8.2,R,Crime,Denis Villeneuve,Hugh JackmanJake GyllenhaalViola Davis,70.0,153.0
Pulp Fiction,1994,8.9,R,Crime,Quentin Tarantino,Quentin TarantinoRoger Avary,95.0,154.0
Puss in Boots: The Last Wish,2022,7.8,PG,Animation,Joel Crawford,Paul FisherTommy SwerdlowTom Wheeler,73.0,102.0
Ratatouille,2007,8.1,G,Animation,Brad Bird,Brad BirdJan PinkavaJim Capobianco,96.0,111.0
Rebel Moon - Part One: A Child of Fire,2023,5.6,PG-13,Action,Zack Snyder,Zack SnyderKurt JohnstadShay Hatten,31.0,133.0
Rebel Moon - Part Two: The Scargiver,2024,5.2,PG-13,Action,Zack Snyder,Zack SnyderKurt JohnstadShay Hatten,35.0,122.0
"Red, White & Royal Blue",2023,7.0,R,Comedy,Matthew López,Taylor Zakhar PerezNicholas GalitzineUma Thurman,62.0,118.0
Rise of the Planet of the Apes,2011,7.6,PG-13,Action,Rupert Wyatt,James FrancoAndy SerkisFreida Pinto,68.0,105.0
Road House,2024,6.2,R,Action,Doug Liman,Anthony BagarozziChuck MondryR. Lance Hill,57.0,121.0
Saltburn,2023,7.0,R,Drama,Emerald Fennell,Barry KeoghanJacob ElordiRosamund Pike,61.0,131.0
Sasquatch Sunset,2024,5.6,R,Action,David Zellner,Jesse EisenbergRiley KeoughChristophe Zajac-Denek,65.0,88.0
Se7en,1995,8.6,R,Crime,David Fincher,Morgan FreemanBrad PittKevin Spacey,65.0,127.0
Seize Them!,2024,5.0,R,Comedy,Curtis Vowell,Aimee Lou WoodJessica HynesMatthew Cottle,44.0,116.3
Shaitaan,2024,6.7,Not Rated,Drama,Vikas Bahl,Aamil Keeyan KhanKrishnadev Yagnik,66.9,132.0
Shrek,2001,7.9,PG,Animation,Andrew Adamson,William SteigTed ElliottTerry Rossio,84.0,90.0
Shrek 2,2004,7.3,PG,Animation,Andrew Adamson,William SteigAndrew AdamsonJoe Stillman,75.0,93.0
Sicario,2015,7.7,R,Action,Denis Villeneuve,Emily BluntJosh BrolinBenicio Del Toro,82.0,121.0
Sing,2016,7.1,PG,Animation,Garth Jennings,Matthew McConaugheyReese WitherspoonSeth MacFarlane,59.0,108.0
Sing 2,2021,7.3,PG,Animation,Garth Jennings,Matthew McConaugheyReese WitherspoonScarlett Johansson,49.0,110.0
Smile,2022,6.5,R,Horror,Parker Finn,Sosie BaconJessie T. UsherKyle Gallner,68.0,115.0
Sonic the Hedgehog 3,2024,7.1,R,Action,Jeff Fowler,Ben SchwartzColleen O'ShaughnesseyIdris Elba,66.9,116.3
Spider-Man: Across the Spider-Verse,2023,8.6,PG,Animation,Joaquim Dos Santos,Shameik MooreHailee SteinfeldBrian Tyree Henry,86.0,140.0
Spider-Man: Beyond the Spider-Verse,2015,7.1,R,Animation,Joaquim Dos Santos,Shameik MooreHailee SteinfeldBrian Tyree Henry,66.9,116.3
Spider-Man: Into the Spider-Verse,2018,8.4,PG,Animation,Bob Persichetti,Phil LordRodney Rothman,87.0,117.0
Spider-Man: No Way Home,2021,8.2,PG-13,Action,Jon Watts,Chris McKennaErik SommersStan Lee,71.0,148.0
Spirited Away,2001,8.6,PG,Animation,Hayao Miyazaki,Hayao Miyazaki,96.0,125.0
Split,2016,7.3,PG-13,Horror,M. Night Shyamalan,James McAvoyAnya Taylor-JoyHaley Lu Richardson,63.0,117.0
Star Wars: Episode I - The Phantom Menace,1999,6.5,PG,Action,George Lucas,Ewan McGregorLiam NeesonNatalie Portman,51.0,136.0
Stardust,2007,7.6,PG-13,Adventure,Matthew Vaughn,Charlie CoxClaire DanesSienna Miller,66.0,127.0
Sting,2024,5.7,R,Horror,Kiah Roache-Turner,Jermaine FowlerRyan CorrAlyla Browne,57.0,92.0
Talk to Me,2022,7.1,R,Horror,Danny Philippou,Ari McCarthyHamish PhillipsKit Erhart-Bruce,76.0,95.0
Tangled,2010,7.7,PG,Animation,Nathan Greno,Mandy MooreZachary LeviDonna Murphy,71.0,100.0
Tarot,2024,4.9,PG-13,Horror,Spenser Cohen,Harriet SlaterAdain BradleyJacob Batalon,36.0,92.0
Taxi Driver,1976,8.2,R,Crime,Martin Scorsese,"Robert De Niro,Jodie Foster,Cybill Shepherd",94.0,114.0
Teenage Mutant Ninja Turtles: Mutant Mayhem,2023,7.2,PG,Animation,Jeff Rowe,Seth RogenEvan GoldbergJeff Rowe,74.0,99.0
The Batman,2022,7.8,PG-13,Action,Matt Reeves,Matt ReevesPeter CraigBob Kane,72.0,176.0
The Beekeeper,2024,6.4,R,Action,David Ayer,Jason StathamEmmy Raver-LampmanBobby Naderi,53.0,105.0
The Bikeriders,2023,7.5,R,Crime,Jeff Nichols,Jodie ComerAustin ButlerTom Hardy,73.0,116.0
The Boy and the Heron,2023,7.6,PG-13,Animation,Hayao Miyazaki,Hayao Miyazaki,91.0,124.0
"The Chronicles of Narnia: The Lion, the Witch and the Wardrobe",2005,6.9,PG,Adventure,Andrew Adamson,Ann PeacockAndrew AdamsonChristopher Markus,75.0,143.0
The Coffee Table,2022,6.8,16+,Comedy,Caye Casas,David ParejaEstefanía de los SantosJosep Maria Riera,72.0,91.0
The Courier,2024,6.0,R,Crime,Daniel Calparsoro,Arón PiperMaría PedrazaLuis Tosar,66.9,116.3
The Crow,1994,7.5,R,Action,Alex Proyas,Brandon LeeMichael WincottRochelle Davis,71.0,102.0
The Crow,2024,7.1,R,Action,Rupert Sanders,Bill SkarsgårdFKA twigsDanny Huston,66.9,116.3
The Dark Knight,2008,9.0,PG-13,Action,Christopher Nolan,Jonathan NolanChristopher NolanDavid S. Goyer,84.0,152.0
The Dead Don't Die,2019,5.5,R,Comedy,Jim Jarmusch,Bill MurrayAdam DriverTilda Swinton,53.0,104.0
The Departed,2006,8.5,R,Crime,Martin Scorsese,Leonardo DiCaprioMatt DamonJack Nicholson,85.0,151.0
The Equalizer,2014,7.2,R,Action,Antoine Fuqua,Denzel WashingtonMarton CsokasChloë Grace Moretz,57.0,132.0
The Equalizer 3,2023,6.8,R,Action,Antoine Fuqua,Denzel WashingtonDakota FanningEugenio Mastrandrea,58.0,109.0
The Fall Guy,2024,7.1,PG-13,Action,David Leitch,Ryan GoslingEmily BluntAaron Taylor-Johnson,73.0,126.0
The Fifth Element,1997,7.6,PG-13,Action,Luc Besson,Luc BessonRobert Mark Kamen,52.0,126.0
The First Omen,2024,6.7,R,Horror,Arkasha Stevenson,Tim SmithArkasha StevensonKeith Thomas,65.0,119.0
The Garfield Movie,2024,5.9,PG,Animation,Mark Dindal,Paul A. KaplanMark TorgoveDavid Reynolds,31.0,101.0
The Gentlemen,2019,7.8,R,Action,Guy Ritchie,Guy RitchieIvan AtkinsonMarn Davies,51.0,113.0
The Godfather,1972,9.2,R,Crime,Francis Ford Coppola,Mario PuzoFrancis Ford Coppola,100.0,175.0
The Goonies,1985,7.7,PG,Adventure,Richard Donner,Sean AstinJosh BrolinJeff Cohen,62.0,114.0
The Green Mile,1999,8.6,R,Crime,Frank Darabont,Tom HanksMichael Clarke DuncanDavid Morse,61.0,189.0
The Holdovers,2023,7.9,R,Comedy,Alexander Payne,Paul GiamattiDa'Vine Joy RandolphDominic Sessa,82.0,133.0
The Hunger Games,2012,7.2,PG-13,Action,Gary Ross,Gary RossSuzanne CollinsBilly Ray,68.0,142.0
The Hunger Games: The Ballad of Songbirds & Snakes,2023,6.7,PG-13,Action,Francis Lawrence,Rachel ZeglerTom BlythViola Davis,54.0,157.0
The Idea of You,2024,6.4,R,Comedy,Michael Showalter,Anne HathawayNicholas GalitzineElla Rubin,67.0,115.0
The Incredibles,2004,8.0,PG,Animation,Brad Bird,Craig T. NelsonSamuel L. JacksonHolly Hunter,90.0,115.0
The Invitation,2022,5.3,PG-13,Horror,Jessica M. Thompson,Nathalie EmmanuelThomas DohertySean Pertwee,45.0,105.0
The Judge,2014,7.4,R,Crime,David Dobkin,Nick SchenkBill DubuqueDavid Dobkin,48.0,141.0
The Killing of a Sacred Deer,2017,7.0,R,Drama,Yorgos Lanthimos,Barry G. BernsonHerb CaillouetBill Camp,73.0,121.0
The Last Stop in Yuma County,2023,7.0,R,Crime,Francis Galluppi,Jim CummingsFaizon LoveJocelin Donahue,72.0,90.0
The Lion King,1994,8.5,G,Animation,Roger Allers,Irene MecchiJonathan RobertsLinda Woolverton,88.0,88.0
The Lion King,2019,6.8,PG,Animation,Jon Favreau,Jeff NathansonIrene MecchiJonathan Roberts,55.0,118.0
The Little Mermaid,2023,7.2,PG,Adventure,Rob Marshall,David MageeHans Christian AndersenJohn Musker,59.0,135.0
The Lord of the Rings: The Fellowship of the Ring,2001,8.9,PG-13,Action,Peter Jackson,J.R.R. TolkienFran WalshPhilippa Boyens,92.0,178.0
The Lord of the Rings: The War of the Rohirrim,2024,7.1,R,Animation,Kenji Kamiyama,Jeffrey AddissPhoebe GittinsWill Matthews,66.9,116.3
The Matrix,1999,8.7,R,Action,Lana Wachowski,Keanu ReevesLaurence FishburneCarrie-Anne Moss,73.0,136.0
The Menu,2022,7.2,R,Comedy,Mark Mylod,Ralph FiennesAnya Taylor-JoyNicholas Hoult,71.0,107.0
The Outsiders,1983,7.0,PG,Crime,Francis Ford Coppola,C. Thomas HowellMatt DillonRalph Macchio,45.0,91.0
The Princess Bride,1987,8.0,PG,Adventure,Rob Reiner,William Goldman,78.0,98.0
The Prodigy,2019,5.9,R,Fantasy,Nicholas McCarthy,Taylor SchillingJackson Robert ScottPeter Mooney,45.0,92.0
The Sandlot,1993,7.8,PG,Comedy,David Mickey Evans,Tom GuiryMike VitarArt LaFleur,55.0,101.0
The Silence of the Lambs,1991,8.6,R,Crime,Jonathan Demme,Jodie FosterAnthony HopkinsScott Glenn,86.0,118.0
The Strangers,2008,6.1,R,Horror,Bryan Bertino,Scott SpeedmanLiv TylerGemma Ward,47.0,86.0
The Strangers: Chapter 1,2024,5.0,R,Horror,Renny Harlin,Madelaine PetschRyan BownMatus Lajcak,43.0,91.0
The Substance,2024,8.0,R,Drama,Coralie Fargeat,Margaret QualleyDemi MooreDennis Quaid,83.0,116.3
The Super Mario Bros. Movie,2023,7.0,PG,Animation,Aaron Horvath,Aaron HorvathMichael JelenicPierre Leduc,46.0,92.0
The Surfer,2024,7.4,R,Thriller,Lorcan Finnegan,Nicolas CageJulian McMahonNicholas Cassim,69.0,116.3
The Talented Mr. Ripley,1999,7.4,R,Crime,Anthony Minghella,Matt DamonGwyneth PaltrowJude Law,76.0,139.0
The Watchers,2024,7.1,PG-13,Fantasy,Ishana Shyamalan,Dakota FanningGeorgina CampbellOlwen Fouéré,66.9,102.0
The Wizard of Oz,1939,8.1,G,Adventure,Victor Fleming,Noel LangleyFlorence RyersonEdgar Allan Woolf,92.0,102.0
The Wolf of Wall Street,2013,8.2,R,Biography,Martin Scorsese,Leonardo DiCaprioJonah HillMargot Robbie,75.0,180.0
Thelma the Unicorn,2024,5.8,PG,Animation,Jared Hess,Brittany HowardWill ForteJon Heder,64.0,93.0
Toy Story,1995,8.3,G,Animation,John Lasseter,John LasseterPete DocterAndrew Stanton,96.0,81.0
Transformers One,2024,7.1,R,Animation,Josh Cooley,Chris HemsworthBrian Tyree HenryScarlett Johansson,66.9,116.3
Trigger Warning,2024,7.1,R,Action,Mouly Surya,Jessica AlbaMark WebberAnthony Michael Hall,66.9,116.3
Trolls Band Together,2023,6.0,PG,Animation,Walt Dohrn,Anna KendrickJustin TimberlakeKenan Thompson,53.0,91.0
Twister,1996,6.5,PG-13,Action,Jan de Bont,Helen HuntBill PaxtonCary Elwes,68.0,113.0
Twisters,2024,7.1,PG-13,Action,Lee Isaac Chung,Mark L. SmithJoseph KosinskiMichael Crichton,66.9,116.3
Unfrosted,2024,5.5,PG-13,Biography,Jerry Seinfeld,Jerry SeinfeldSpike FerestenAndy Robin,42.0,97.0
Unsung Hero,2024,7.8,PG,Drama,Richard L. Ramsey,Richard L. RamseyRichard RamseyJoel Smallbone,46.0,113.0
Up,2009,8.3,PG,Animation,Pete Docter,Pete DocterBob PetersonTom McCarthy,88.0,96.0
Upgrade,2018,7.5,R,Action,Leigh Whannell,Logan Marshall-GreenMelanie VallejoSteve Danielsen,67.0,100.0
WALL·E,2008,8.4,G,Animation,Andrew Stanton,Andrew StantonPete DocterJim Reardon,95.0,98.0
War for the Planet of the Apes,2017,7.4,PG-13,Action,Matt Reeves,Mark BombackMatt ReevesRick Jaffa,82.0,140.0
We're the Millers,2013,7.0,R,Comedy,Rawson Marshall Thurber,"Bob FisherSteve , FaberSean Anders",44.0,110.0
Where the Crawdads Sing,2022,7.2,PG-13,Drama,Olivia Newman,Daisy Edgar-JonesTaylor John SmithHarris Dickinson,43.0,125.0
Wicked Little Letters,2023,7.0,R,Comedy,Thea Sharrock,Jessie BuckleyOlivia ColmanTimothy Spall,58.0,100.0
Willy Wonka & the Chocolate Factory,1971,7.8,G,Adventure,Mel Stuart,Roald DahlRobert KaufmanDavid Seltzer,67.0,100.0
Wish,2023,5.6,PG,Animation,Chris Buck,Jennifer LeeAllison MooreChris Buck,47.0,95.0
Wonka,2023,7.0,PG,Adventure,Paul King,Roald DahlPaul KingSimon Farnaby,66.0,116.0
X,2022,6.5,R,Horror,Ti West,Mia GothJenna OrtegaBrittany Snow,80.0,105.0
You Can't Run Forever,2024,4.4,R,Drama,Michelle Schumacher,J.K. SimmonsFernanda UrrejolaAllen Leech,66.9,102.0
Your Name.,2016,8.4,R,Animation,Makoto Shinkai,Makoto ShinkaiClark Cheng,81.0,116.3
Zootopia,2016,8.0,PG,Animation,Byron Howard,Byron HowardRich MooreJared Bush,78.0,108.0
